{
  "dataset": "community_signals",
  "as_of": "2026-03-20T20:14:44.603849Z",
  "version": 1,
  "windows": [
    {
      "window_id": "7d",
      "label": "Last 7 Days",
      "since": "2026-03-13T00:00:00+00:00",
      "metrics": {
        "active_proposals_now": 2,
        "proposal_count": 3,
        "successful_proposal_count": 1,
        "payout_count": 1,
        "delivery_count": 4,
        "recipient_count": 1,
        "project_count": 0,
        "unique_voters_count": 37,
        "avg_votes_per_proposal": 24.0,
        "median_votes_per_proposal": 24.0,
        "proposal_success_rate_pct": 33.33,
        "payouts_per_proposal": 0.333,
        "deliveries_per_proposal": 1.333,
        "payouts_by_asset": [
          {
            "symbol": "USDC",
            "amount": 1570.0
          }
        ]
      },
      "top_recipients": [
        {
          "address": "0x25810d1a8b1affc444d5333bf0496f1202d6f89f",
          "display_name": "0x2581...f89f",
          "totals_by_asset": [
            {
              "symbol": "USDC",
              "amount": 1570.0
            }
          ]
        }
      ],
      "top_projects": [],
      "top_proposals": [
        {
          "archive_id": "gnars-base-117",
          "proposal_number": 117,
          "title": "Sponsor Gnars Monik Santos in QS/WSL 2026",
          "status": "executed",
          "totals_by_asset": [
            {
              "symbol": "USDC",
              "amount": 1570.0
            }
          ]
        }
      ],
      "top_people": [
        {
          "address": "0x25810d1a8b1affc444d5333bf0496f1202d6f89f",
          "display_name": "0x2581...f89f",
          "received_totals": [
            {
              "symbol": "USDC",
              "amount": 1570.0
            }
          ],
          "authored_count": 1,
          "delivery_count": 0,
          "score": 1572.0,
          "tribes": [
            "athlete",
            "contributor",
            "delegate",
            "holder",
            "proposer",
            "recipient"
          ]
        },
        {
          "address": "0x39a7b6fa1597bb6657fe84e64e3b836c37d6f75d",
          "display_name": "r4topunk",
          "received_totals": [],
          "authored_count": 1,
          "delivery_count": 3,
          "score": 6.5,
          "tribes": [
            "athlete",
            "builder",
            "contributor",
            "delegate",
            "holder",
            "member",
            "proposer",
            "recipient"
          ]
        },
        {
          "address": "0xaaed9fff9858d48925904e391b77892ba5fda824",
          "display_name": "fcarva",
          "received_totals": [],
          "authored_count": 0,
          "delivery_count": 4,
          "score": 6.0,
          "tribes": [
            "builder",
            "contributor",
            "delegate",
            "holder",
            "member",
            "proposer"
          ]
        },
        {
          "address": "0x8bf5941d27176242745b716251943ae4892a3c26",
          "display_name": "vlad",
          "received_totals": [],
          "authored_count": 0,
          "delivery_count": 3,
          "score": 4.5,
          "tribes": [
            "builder",
            "contributor",
            "delegate",
            "holder",
            "member"
          ]
        },
        {
          "address": "0x2feb329b9289b60064904fa61fc347157a5aed6a",
          "display_name": "zimardrp.eth",
          "received_totals": [],
          "authored_count": 1,
          "delivery_count": 0,
          "score": 2.0,
          "tribes": [
            "athlete",
            "contributor",
            "delegate",
            "holder",
            "proposer",
            "recipient"
          ]
        }
      ]
    },
    {
      "window_id": "30d",
      "label": "Last 30 Days",
      "since": "2026-02-18T00:00:00+00:00",
      "metrics": {
        "active_proposals_now": 2,
        "proposal_count": 7,
        "successful_proposal_count": 1,
        "payout_count": 1,
        "delivery_count": 4,
        "recipient_count": 1,
        "project_count": 0,
        "unique_voters_count": 38,
        "avg_votes_per_proposal": 11.86,
        "median_votes_per_proposal": 7.0,
        "proposal_success_rate_pct": 14.29,
        "payouts_per_proposal": 0.143,
        "deliveries_per_proposal": 0.571,
        "payouts_by_asset": [
          {
            "symbol": "USDC",
            "amount": 1570.0
          }
        ]
      },
      "top_recipients": [
        {
          "address": "0x25810d1a8b1affc444d5333bf0496f1202d6f89f",
          "display_name": "0x2581...f89f",
          "totals_by_asset": [
            {
              "symbol": "USDC",
              "amount": 1570.0
            }
          ]
        }
      ],
      "top_projects": [],
      "top_proposals": [
        {
          "archive_id": "gnars-base-117",
          "proposal_number": 117,
          "title": "Sponsor Gnars Monik Santos in QS/WSL 2026",
          "status": "executed",
          "totals_by_asset": [
            {
              "symbol": "USDC",
              "amount": 1570.0
            }
          ]
        }
      ],
      "top_people": [
        {
          "address": "0x25810d1a8b1affc444d5333bf0496f1202d6f89f",
          "display_name": "0x2581...f89f",
          "received_totals": [
            {
              "symbol": "USDC",
              "amount": 1570.0
            }
          ],
          "authored_count": 1,
          "delivery_count": 0,
          "score": 1572.0,
          "tribes": [
            "athlete",
            "contributor",
            "delegate",
            "holder",
            "proposer",
            "recipient"
          ]
        },
        {
          "address": "0x39a7b6fa1597bb6657fe84e64e3b836c37d6f75d",
          "display_name": "r4topunk",
          "received_totals": [],
          "authored_count": 1,
          "delivery_count": 3,
          "score": 6.5,
          "tribes": [
            "athlete",
            "builder",
            "contributor",
            "delegate",
            "holder",
            "member",
            "proposer",
            "recipient"
          ]
        },
        {
          "address": "0x4b5951ca3fd19897feb9e42609f252b609eae526",
          "display_name": "ai.gami.eth",
          "received_totals": [],
          "authored_count": 3,
          "delivery_count": 0,
          "score": 6.0,
          "tribes": [
            "athlete",
            "contributor",
            "proposer"
          ]
        },
        {
          "address": "0xaaed9fff9858d48925904e391b77892ba5fda824",
          "display_name": "fcarva",
          "received_totals": [],
          "authored_count": 0,
          "delivery_count": 4,
          "score": 6.0,
          "tribes": [
            "builder",
            "contributor",
            "delegate",
            "holder",
            "member",
            "proposer"
          ]
        },
        {
          "address": "0x8bf5941d27176242745b716251943ae4892a3c26",
          "display_name": "vlad",
          "received_totals": [],
          "authored_count": 0,
          "delivery_count": 3,
          "score": 4.5,
          "tribes": [
            "builder",
            "contributor",
            "delegate",
            "holder",
            "member"
          ]
        },
        {
          "address": "0x4d16fce1bd6e327ae31398ce9a2c4e12c077ecb1",
          "display_name": "swarthyhatter.eth",
          "received_totals": [],
          "authored_count": 1,
          "delivery_count": 0,
          "score": 2.0,
          "tribes": [
            "contributor",
            "delegate",
            "holder",
            "proposer"
          ]
        },
        {
          "address": "0x2feb329b9289b60064904fa61fc347157a5aed6a",
          "display_name": "zimardrp.eth",
          "received_totals": [],
          "authored_count": 1,
          "delivery_count": 0,
          "score": 2.0,
          "tribes": [
            "athlete",
            "contributor",
            "delegate",
            "holder",
            "proposer",
            "recipient"
          ]
        }
      ]
    },
    {
      "window_id": "90d",
      "label": "Last 90 Days",
      "since": "2025-12-20T00:00:00+00:00",
      "metrics": {
        "active_proposals_now": 2,
        "proposal_count": 11,
        "successful_proposal_count": 2,
        "payout_count": 1,
        "delivery_count": 4,
        "recipient_count": 1,
        "project_count": 0,
        "unique_voters_count": 52,
        "avg_votes_per_proposal": 13.27,
        "median_votes_per_proposal": 11.0,
        "proposal_success_rate_pct": 18.18,
        "payouts_per_proposal": 0.091,
        "deliveries_per_proposal": 0.364,
        "payouts_by_asset": [
          {
            "symbol": "USDC",
            "amount": 1570.0
          }
        ]
      },
      "top_recipients": [
        {
          "address": "0x25810d1a8b1affc444d5333bf0496f1202d6f89f",
          "display_name": "0x2581...f89f",
          "totals_by_asset": [
            {
              "symbol": "USDC",
              "amount": 1570.0
            }
          ]
        }
      ],
      "top_projects": [],
      "top_proposals": [
        {
          "archive_id": "gnars-base-117",
          "proposal_number": 117,
          "title": "Sponsor Gnars Monik Santos in QS/WSL 2026",
          "status": "executed",
          "totals_by_asset": [
            {
              "symbol": "USDC",
              "amount": 1570.0
            }
          ]
        }
      ],
      "top_people": [
        {
          "address": "0x25810d1a8b1affc444d5333bf0496f1202d6f89f",
          "display_name": "0x2581...f89f",
          "received_totals": [
            {
              "symbol": "USDC",
              "amount": 1570.0
            }
          ],
          "authored_count": 1,
          "delivery_count": 0,
          "score": 1572.0,
          "tribes": [